file	path	sfillers	sentence
Royal_Society_Corpus_open_v6.0_text_107073_1803.txt	pa_nsubj	damp/A	The air is very damp . ( 2 . ) Nov. 23 , 1781 . 15 h go ' .
Royal_Society_Corpus_open_v6.0_text_107073_1803.txt	pa_nsubj	moist/A	The air is very moist , and intermixed with passing clouds . ( 3 . ) Sept. 7 , 1782 . I viewed the double star preceding 12 Camelopardalis , * with 932 .
Royal_Society_Corpus_open_v6.0_text_107073_1803.txt	pa_nsubj	enemy/N	In this , and several other fine nights which I have lately had , the condensing moisture on the tube of my telescope has been running down in streams ; which proves that damp air is no enemy to good vision . ( 4 , ) Dec. 28 , 1782 . 17h
Royal_Society_Corpus_open_v6.0_text_107073_1803.txt	pa_nsubj	calm/A	There is a strong frost . ( 19 . ) Jan. 31 , 1782 . I can not see with a power of 460 , the stars seem to dance so unaccountably , and yet the air is perfectly calm : even at 60 or 70 degrees of altitude , vision is impaired . ( 20 . ) Feb. 9 , 1782 .
Royal_Society_Corpus_open_v6.0_text_107073_1803.txt	pa_nsubj	hazy/A	The air was very hazy , but extremely calm .
Royal_Society_Corpus_open_v6.0_text_107073_1803.txt	pa_nsubj	proper/A	If moisture in the atmosphere be necessary , dry air can not be proper for vision .
Royal_Society_Corpus_open_v6.0_text_109646_1800.txt	pa_nsubj	perform/V	After some preliminary observations upon the important part that atmospheric air performs in numerous processes of nature and art , and upon the variety of other gaseous bodies now known , Mr. Pepys traces cursorily the progress of eudiometry from Hales , who first observed a contraction upon the admixture of atmospheric air with an air that he had obtained from spirit of nitre and pyrites .
Royal_Society_Corpus_open_v6.0_text_107066_1803.txt	pa_nsubj	be/A	Such distances are however by no means necessary ; and indeed the air over the river , in cold weather , is generally , or at least very frequently , not sufficiently clear for seeing distinctly to so great distances .
Royal_Society_Corpus_open_v6.0_text_107066_1803.txt	pa_nsubj	clear/A	In this observation I think that I could not be mistaken , as the water was at the time perfectly calm , the air uncommonly clear , and I had leisure to pay particular attention to so unforeseen an occurrence .
Royal_Society_Corpus_open_v6.0_text_107050_1800.txt	pa_nsubj	incomplete/A	It was evident from these experiments , that the membLrana tympani of each ear was incomplete , and that the air issued from the mouth , by the Eustachian tuber through an opening in that membrane , and escaped by the external meatus .
Royal_Society_Corpus_open_v6.0_text_107050_1800.txt	pa_nsubj	suffer/V	In a healthy ear , when the meatus auditorius is stopped by the finger , or is otherwise closed , a noise similar to that of a distant roaring of the sea is produced : this arises from the air in the meatus being compressed upon the membrana tympani . the case here described , no such sensation was produced : for , in Mr. P 's ear , the air , meeting with no impediment , could suffer no compression ; since it found a passage , through the open membrane , to the mouth , by means of the Eustachian , tube .
Royal_Society_Corpus_open_v6.0_text_107050_1800.txt	pa_nsubj	capable/A	That , in cases in which the membrana tympani has been destroyed , the air is capable of acting with sufficient force upon the stapes to communicate vibrations to it , and to produce on the internal organ the necessary effect for perfect hearing , , is completely ascertained by Mr. CooPER 's observations .
Royal_Society_Corpus_open_v6.0_text_109778_1800.txt	pa_nsubj	become/V	In consequence of this arrangement , if the air of the mine becomes liable to inflame , the explosion will be confined to the mere content of the lantern , of which only a small part will be consumed , unless the quantity of inflammable gas be very suddenly increased .
Royal_Society_Corpus_open_v6.0_text_107049_1800.txt	pa_nsubj	escape/V	As the air escaped through the puncture , it was supplied by a phial of known dimensions , at equal intervals of time ; and , according to the frequency of this supply , the average height of the gage was such as is expressed in the first Table .
Royal_Society_Corpus_open_v6.0_text_107105_1801.txt	pa_nsubj	render/V	Air rendered azotic , by burning Spirit of Wine in it , when confined above Water . ' Exper . 7 . A portion of fresh herring , of about three drams , was put above water , into this azotic gas , at 5 P. M.
Royal_Society_Corpus_open_v6.0_text_109577_1800.txt	pa_nsubj	come/V	The warm winds , he says , which in summer blow over the surface of this column of ice - cold water , must evidently communicate some small degree of heat to those particles of the fluid with which this warm air comes into immediate contact ; and the particles of the water at the surface so heated , being rendered specifically heavier than they were before by this small increase of temperature , sink slowly to the bottom of the pit ; and here they come in contact with the ice , and communicate to it the heat by which the depth of the pit is continually increased .
Royal_Society_Corpus_open_v6.0_text_107055_1800.txt	pa_nsubj	rise/V	It must be remarked , that the vertical position of the surface contributes greatly to increase the effect ; for , since the heated - air rises in the direction of the surface , its ascent has in this case no tendency to blend it with the adjacent denser strata , and hence very different degrees of density take place in the thickness of 4 of an inch ; so that , as the increments of density are great , the refractions will be proportionally so ; but , - where the heated surface is horizontal , the ascent of the rarefied air into the superincumbent denser strata renders the variations far more gradual ; consequently , a heated surface of far greater extent must be requisite , to produce equal refraction .
Royal_Society_Corpus_open_v6.0_text_107055_1800.txt	pa_nsubj	object/V	Why air heated by the moderate warmth of the sun 's rays , occasions objects to appear doubled and inverted . 2dly .
Royal_Society_Corpus_open_v6.0_text_107087_1801.txt	pa_nsubj	200/N	Some of the powder above mentioned , ( which had been previously subjected to a temperature of 47 cO , without melting , ) I mixed with snow , each at the temperature of + 820 ; when the thermometer , to my perfect satisfaction , sunk to - 40 ' and , at another time , when the air was + 200 , I froze quick . silver perfectly solid , by a mixture of the same materials .
Royal_Society_Corpus_open_v6.0_text_109567_1800.txt	pa_nsubj	means/N	Dry air , it seems , is by no means proper for vision ; and hence dampness , haziness , and fogs , to a certain degree , will generally be found favourable to distinctness : damp situations , therefore , and the neighbourhood of lakes or rivers , need not be objected to in choosing a spot for an observe tory .
Royal_Society_Corpus_open_v6.0_text_107137_1804.txt	pa_nsubj	come/V	The warm winds which , in summer , blow over the surface of this column of ice - cold water , must undoubtedly communicate some small degree of heat to those particles of the fluid with which this warm air comes into immediate contact ; and the particles of the water at the surface so heated , being rendered specifically heavier than they were before , by this small increase of temperature , sink slowly to the bottom of the pit ; where they come into contact with the ice , and communicate to it the heat by which the depth of the pit is continually increased .
Royal_Society_Corpus_open_v6.0_text_107141_1804.txt	pa_nsubj	adhere/V	As it is well known that air adheres with considerable obstinacy to the surfaces of some solid bodies , I conceived it to be possible , that the particles of air in immediate contactwith the surface of the cylindrical vessel No. 1 , might in fact be so at . tached to the metal as to adhere to it with some considerable force ; and , if that were the case , as confined air is known to constitute a very warm covering , it appeared to me to be possible , that the cooling of the vessel No. in might have been retarded by such an invisible covering of confined air ; which covering , in the experiment With the vessel No. 2 , had been displaced , and in a great measure driven away , by the colder covering , of linen , by which the body of the instrument was closely embraced .
Royal_Society_Corpus_open_v6.0_text_107141_1804.txt	pa_nsubj	accelerate/V	When we consider this experiment with attention , we shall find reason to conclude , that if it were by facilitating the approach and temporary contact of a succession of fresh particles of the cold air of the room to the surface of the glue , ( which was now in fact become the surface of the hot body , ) that the cooling of the instrument was accelerated the metal being as completely covered , and the air , supposed to be attached and fixed to its surface , as completely excluded by one coating of the glue as it could be by two , or more , two coatings could not possibly accelerate the cooling of the instrument more than one ; but if , on the other hand , the cooling of the instrument in this experiment was accelerated , not by facilitating and accelerating the motions of the circumambient cold air , but by facilitating and increasing those radiations which are known to proceed from hot bodies , I conceived that two coatings of the glue might possibly accelerate the cooling of the vessel more than one .
Royal_Society_Corpus_open_v6.0_text_107141_1804.txt	pa_nsubj	'/N	Exper . No. 6 . Being desirous of finding out whether or not the covering of animal matter , which had so remarkably facilitated the cooling of the instrument No. 4 , would be equally efficacious in facilitating the passage of heat into the instrument , I suffered both instruments to remain in the cold room all night ; and , entering the next morning , at half an hour past seven o'clock , I found the temperature of the water in the naked instrument , No , A , to be $o ? : that in the instrument No. d , which was covered with gold - beater 's skin , was 49 - O ; while the air of the room was at 48 ' . At 7 h 3on A. M. I removed both instruments into a warm room , and , observed the times of their acquiring heat to be as expressed in the following Table .
Royal_Society_Corpus_open_v6.0_text_107141_1804.txt	pa_nsubj	take/V	It is evident , that the greater the power is which an animal possesses of throwing off heat from the surface of his body , independently of that which the surrounding air takes off , the less will his temperature be affected by the occasional changes of DMCCCIV .
Royal_Society_Corpus_open_v6.0_text_107141_1804.txt	pa_nsubj	cold/A	And , even should it be true , that bodies are cooled , not in consequence of the rays they emit , but by the action of those frigorific rays they receive from other colder bodies , ( which I much suspect to be the case , ) yet , as it has been found by experiment , that those bodies which emit calorific rays in the greatest abundance , are also most affected by the frigorific rays of colder bodies , it is evident , that in a very hot country , where the air and all other surrounding bodies are but very little colder than ' the surface of the skin , those who by their colour are prepared and disposed to be cooled with the greatest facility , will be the least likely to be oppressed by the accumulation of the heat generated in them by respiration , or of that excited by the sun 's rays .
Royal_Society_Corpus_open_v6.0_text_107141_1804.txt	pa_nsubj	have/V	In this position of the vessel No. 6 , it is evident that the air , heated by coming into contact with its bottom , had full liberty to escape Upwards , and to ' make way for other particles of colder air to come into'contact with the hot surface , and be heated , rarefled , and forced upwards , in their turns ; and , under these circumstances , it might reasonably be expected , that as much heat as possible would be communicated immediately to the air , by the hot body ; and that the heat so communicated would of course accelerate the cooling of that vessel .
Royal_Society_Corpus_open_v6.0_text_107141_1804.txt	pa_nsubj	remain/V	Suppose two concave reflecting mirrors , of highly polished metal , each i8 inches in diameter , and i8 inches focal distance . to be placed opposite to - each other , at the distance of Io feet , in a large quiet room , in which the air , and the walls of the room , remain constantly at the same temperature , ( that of freezing water , for instance , ) without any variation .
Royal_Society_Corpus_open_v6.0_text_107141_1804.txt	pa_nsubj	have/V	This neck is placed in the centre of the circular flat top , or upper end , of the vertical cylindrical body ; and , opposite to it , in the centre of the flat bottom of the body , there is a hollow cylinder , 1 of an inch in diameter , and 3 inches long , projecting downwards , into which a vertical cylinder of wood is fitted , on the top of which the instrument is supported , in such a manner that the air has free access to every part of it .
Royal_Society_Corpus_open_v6.0_text_107141_1804.txt	pa_nsubj	580/N	When , for instance , the air was at 580 , the interval commenced at the lo8th degree , and ended at the 98th .
Royal_Society_Corpus_open_v6.0_text_107141_1804.txt	pa_nsubj	641/N	When the air was at 641 , it commenced at i 14X0 , and ended at 1o04 - 4
Royal_Society_Corpus_open_v6.0_text_107141_1804.txt	pa_nsubj	degree/N	That the same instrument , exposed to cool in the air , does in fact cool the same number of degrees in the same time , very nearly , when the given interval of the scale of the thermometer is reckoned from the same height , or given number of degrees above the temperature of the air at the time when the experiment is made , will appear from the following results of Ai different experiments , made on different days , and when the air in which the instrument was exposed to cool was at different degrees of temperature .
Royal_Society_Corpus_open_v6.0_text_107141_1804.txt	pa_nsubj	perature/N	The large cylindrical vessel No. i , with its ends covered with warm clothing , in the manner before described , and its vertical sides ( which were polished , and very clean and bright ) exposed naked to the air , was filled with water nearly boiling hot , and placed on its wooden stand , on a table , in a large quiet room , to cool ; the air of the room being at the tems perature of 450 FAHRENHEIT .
Royal_Society_Corpus_open_v6.0_text_107141_1804.txt	pa_nsubj	temperature/N	Desirous of seeing whether the same covering would , or would not , expedite the passage of heat into the instrument ; after having suffered both instruments to cool down to the temperature of about 420 , I removed them into a warm room , in which the air was at the temperature of 620 ; and I found that the instrument No. 2 , which was clothed , acquired heat considerably faster than the other , No. i , which was naked . *
Royal_Society_Corpus_open_v6.0_text_107068_1803.txt	pa_nsubj	remain/V	Air remaining in } the bent tube J ' 75 5.38 , total gas from ii7 7 inches of water .
Royal_Society_Corpus_open_v6.0_text_106499_1783.txt	pa_nsubj	pass/V	The principal cause which prevents this pump to exhaust farther than that limit is the weakened elasticity of the air remaining within the receiver , which , decreasing in proportion is the quantity of the air within the receiver is diminished , becomes at last incapable of lifting up the valve , which opens the communication between the receiver and the barrel ; consequently no more air can in that case pass from the former to the latter .
Royal_Society_Corpus_open_v6.0_text_106499_1783.txt	pa_nsubj	make/V	It will be easily conceived , that when the air is forced through the hole 3 , it will lift up the slip of oil - silk , and passing by the sides of it , and also through the large perforation of the piece 2,4 , will go upwards , &amp ;c. ; but can by no means return backwards , since any pressure , that the air makes on the upper part of the oil silk , will only stop the passage more effectually .
Royal_Society_Corpus_open_v6.0_text_106499_1783.txt	pa_nsubj	pass/V	6 . It appears from this description , that the air can pass through the valve from without to within the barrel , but not vice versa .
Royal_Society_Corpus_open_v6.0_text_106499_1783.txt	pa_nsubj	pass/V	It will be also easily conceived , that the air can pass from the cavity of the tube R through the perforation of the pieces L and K , within the cavity of the barrel , only when the said air has elasticity , or force enough to push up the oil - silk .
Royal_Society_Corpus_open_v6.0_text_106499_1783.txt	pa_nsubj	have/V	It will be also easily conceived , that the air can pass from the cavity of the tube R through the perforation of the pieces L and K , within the cavity of the barrel , only when the said air has elasticity , or force enough to push up the oil - silk .
Royal_Society_Corpus_open_v6.0_text_106499_1783.txt	pa_nsubj	pass/V	4 . pl. III . is moved upwards , the wires 9 , 9 , and likewise the double ring 8 , 8 , with the oil - silk , being all connected together , will be pushed also upwards ; consequently , the oil - silk being removed from the hole of the piece K , a free communication is opened between the cavity of the tube R , and the cavity of the barrel , through which the air , however rarefied or weakened in elasticity , can pass without the least impediment .
Royal_Society_Corpus_open_v6.0_text_106499_1783.txt	pa_nsubj	pass/V	Then the piston on being let down , the air passes through the valve of the piston , to the upper part of the barrel , and when afterwards the piston is drawn up , this air is forced through the valve at E into the tube Dr , from thence into the vessel qs , through the channel pn , and , lastly , it will be expelled into the atmosphere through the aperture k .
Royal_Society_Corpus_open_v6.0_text_106499_1783.txt	pa_nsubj	go/V	But if the stop - cocks Z and h are so turned as that the side hole of the cock h , as well as that of the cock Z , is turned towards X , then , by the action of the pump , the air , instead of being exhausted , is condensed into the receiver properly placed upon the plate ff ; for now the air coming from the atmosphere through the aperture X goes down the cavity of the tube RS , enters the barrel , and from the barrel is impelled upwards through Dr , through pn , through a , b , d , and lastly into the receiver , which in that case must be pressed down , as is usually done in condensing engines .
Royal_Society_Corpus_open_v6.0_text_106499_1783.txt	pa_nsubj	pass/V	Thus , suppose I want to introduce some fixed air into the receiver ; first , I exhaust the common air from the receiver , then put the stop - cock of a bladder containing fixed air to the hole X ; lastly I open the stop - cock of the bladder , and turn the cocks hZ , so that their side - holes may be turned towards X , and by working the pump the fixed air will immediately pass from the bladder into the receiver .
Royal_Society_Corpus_open_v6.0_text_106499_1783.txt	pa_nsubj	rarefied/V	Air rarefied 40 times .
Royal_Society_Corpus_open_v6.0_text_106541_1781.txt	pa_nsubj	dry/A	He found , however , that he could bear a much greater degree of heat when the air was dry .
Royal_Society_Corpus_open_v6.0_text_106541_1781.txt	pa_nsubj	77/N	It may not be improper here to observe , that healthy frogs , in an atmosphere above 70 ~ , keep themselves at a lower temperature than the external air , but are warmer internally than at the surface of their bodies : for when the air was 77 ~ , a frog was found to be 68 ~ , the thermometer being placed in contact with the skin ; but when the thermometer was introduced into the stomach , it rose to 70~1 / 2 .
Royal_Society_Corpus_open_v6.0_text_106484_1783.txt	pa_nsubj	follow/V	He reasoned upon a supposition , that the air in motion followed the same laws as light ; and that it was reflected from surfaces with the angle of reflection equal to the angle of incidence , which is not the case , as it never makes an angle with the plane , but is always reflected in curves .
Royal_Society_Corpus_open_v6.0_text_106594_1784.txt	pa_nsubj	contain/V	It has been known for some time , that inflammable air contained much phlogiston ; and Dr. PRIESTLEY has found , by some experiments made lately , that it ` ` is either wholly pure phlogiston , or at least that it contains no apparent mixture of any other matter . ' ' ( In my opinion , however , it contains a small quantity of water and much elementary *
Royal_Society_Corpus_open_v6.0_text_106594_1784.txt	pa_nsubj	phlogiston/N	Therefore , as so great a quantity of inflammable air had been absorbed by the metallic calces ; the effect of reducing them to their metallic state had been produced ; and the small remaining portion was still unchanged , at least had suffered no change which might not be attributed to its original want of purity ; it was reasonable to conclude , that inflammable air must be the pure phlogiston , or the matter which reduced the calces to metals . 2 . ` ` The same ingenious philosopher mixed together certain proportions of pure dry dephlogisticated air and of pure dry inflammable air in a strong glass vessel , closely shut , and then set them on fire by means of the electric spark , ' ' in the same manner as is done in the inflammable air pistol .
Royal_Society_Corpus_open_v6.0_text_106594_1784.txt	pa_nsubj	phlogiston/N	Previous to Dr. PRIESTLEY 'S making these experiments , M. KIRWAN had proved , by very ingenious deductions from other facts , that inflammable air was , in all probability , the real phlogiston , in an aerial form .
Royal_Society_Corpus_open_v6.0_text_106594_1784.txt	pa_nsubj	unite/V	Are we not then authorised to conclude , that water is composed of dephlogisticated air and phlogiston , deprived of part of their latent or elementary heat ; that dephlogisticated or pure air is composed of water deprived of its phlogiston , and united to elementary heat and light ; and that the latter are contained in it in a latent state , so as not to be sensible to the thermometer or to the eye ; and if light be only a modification of heat , or a circumstance attending it , or a component part of the inflammable air , then pure or dephlogisticated air is composed of water deprived of its phlogiston and united to elementary heat ? ' ' 4 . ` ` It appears , that dephlogisticated water , ' ' or , which may be a better name for the basis of water and air , the element you call humor , ` ` has a more powerful attraction for phlogiston than it has for latent heat , but that it can not unite with it , at least not to the point of saturation , or to the total expulsion of the heat , unless it be first made redhot , ' ' or nearly so . ` ` The electric spark heats a portion of it red - hot , the attraction between the humor and the phlogiston takes place , and the heat which is let loose from this first portion heats a second , which operates in a like manner on the adjoining particles , and so continually until the whole is heated red - hot and decomposed . ' ' Why this attraction does not take place to the same degree in the common temperature of the atmosphere , is a question I am not yet able to solve ; but it appears , that , in some circumstances , ` ` dephlogisticated air can unite , in certain degrees , with phlogiston without being changed into water . ' ' Thus Dr. PRIESTLEY has found , that by taking clean filings of iron , which , alone , produce only inflammable air of the purest kind , and mercurius calcinatus per se , which gives only the purest dephlogisticated air , and exposing them to heat , in the same vessel , he obtained neither dephlogisticated nor inflammable air , ` ` but in their place fixed air . ' ' Yet it is well known , that a mixture of dephlogisticated and inflammable air will remain for years in close vessels in the common heat of the atmosphere , without suffering any change , the mixture being as capable of deflagration at the end of that time as it was when first shut up .
Royal_Society_Corpus_open_v6.0_text_106594_1784.txt	pa_nsubj	seem/V	These facts the Doctor accounts for , by supposing that the two kinds of air , when formed at the same time in the same vessel , can unite in their nascent state ; but that , when fully formed , they are incapable of acting upon one another , unless they are first set in motion by external heat . ` ` Phlogisticated air seems also to be another composition of phlogiston and dephlogisticated air ; ' ' but in what proportions they are united , or by what means , is still unknown .
