file	path	sfillers	sentence
Royal_Society_Corpus_open_v6.0_text_106582_1784.txt	pa_nsubj	absorb/V	What principally makes me think so is , that common or dephlogisticated air do not absorb phlogiston from inflammable air , unless assisted by a red heat , whereas they absorb the phlogiston of nitrous air , liver of sulphur , and many other substances , without that assistance ; and it seems inexplicable , that they should refuse to unite to pure phlogiston , when they are able to extract it from substances to which it has an affinity ; that is , that they should overcome the affinity of phlogiston to other substances , and extract it from them , when they will not even unite to it when presented to them .
Royal_Society_Corpus_open_v6.0_text_106582_1784.txt	pa_nsubj	small/A	I am not sufficiently acquinted with the circumstances of that experiment to argue with certainty about it ; but I think it much more likely , that the inflammable air was formed by the union of the phlogiston of the iron filings with the water dispersed among them , or contained in the retort or other vessel in which it was heated ; and in all probability this was the cause of the separation of the phlogiston , as iron seems not disposed to part with its phlogiston by heat alone , without being assisted by the air or some other substance . as it is found , that the phlogisticated air , which it is converted into , is very small in comparison of the dephlogisticated air .
Royal_Society_Corpus_open_v6.0_text_106582_1784.txt	pa_nsubj	contain/V	I think the second of these explnations seems much the most likely ; as it was found , that the acid in the condensed liquor was of the nitrous kind , not only when the dephlogisticated air was prepared from red precipitate , but also when it was procured from plants or from turbith mineral : and it seeems not likely , that air procured from plants , and still less likely that air procured from a solution of mercury in oil of vitriol , should contain any nitrous acid .
Royal_Society_Corpus_open_v6.0_text_106582_1784.txt	pa_nsubj	contain/V	I think the second of these explnations seems much the most likely ; as it was found , that the acid in the condensed liquor was of the nitrous kind , not only when the dephlogisticated air was prepared from red precipitate , but also when it was procured from plants or from turbith mineral : and it seeems not likely , that air procured from plants , and still less likely that air procured from a solution of mercury in oil of vitriol , should contain any nitrous acid .
Royal_Society_Corpus_open_v6.0_text_106582_1784.txt	pa_nsubj	yield/V	Another strong argument in favour of this opinion is , that dephlogisticated air yields no nitrous acid when phlogisticated by liver of sulphur ; for if this air contains nitrous acid , and yields it when phlogisticated by explosion with inflammable air , it is very extraordinary that it should not do so when phlogisticated by other means .
Royal_Society_Corpus_open_v6.0_text_106582_1784.txt	pa_nsubj	contain/V	Another strong argument in favour of this opinion is , that dephlogisticated air yields no nitrous acid when phlogisticated by liver of sulphur ; for if this air contains nitrous acid , and yields it when phlogisticated by explosion with inflammable air , it is very extraordinary that it should not do so when phlogisticated by other means .
Royal_Society_Corpus_open_v6.0_text_106582_1784.txt	pa_nsubj	pure/A	But what forms a stronger and , I think , almost decisive argument in favour of this explanation is , that when the dephlogisticated air is very pure , the condensed liquor is made much more strongly acid by mixing the air to be exploded with a little phlogisticated air , as appears by the following experiments .
Royal_Society_Corpus_open_v6.0_text_106582_1784.txt	pa_nsubj	phlogisticated/A	It must be observed , that all circumstances were the same in these two experiments , except that in the latter the air to be exploded was mixed with some phlogisticated air , and that in consequence the burnt air was more phlogisticated than in the former ; and from what has been before said , it appears , that this latter circumstance ought rather to have made the condensed liquor less acid ; and yet it was found to be much more so , which shows strongly that it was the phlogisticated air which furnished the acid .
Royal_Society_Corpus_open_v6.0_text_106582_1784.txt	pa_nsubj	free/A	In the first of these two experiments , in order that the air to be exploded should be as free as possible from common air , the globe was first filled with a mixture of dephlogisticated and inflammable air , it was then exhausted , and the air to be exploded let in ; by which means , though the globe was not perfectly exhausted , very little common air could be left in it .
Royal_Society_Corpus_open_v6.0_text_106582_1784.txt	pa_nsubj	let/V	In the first of these two experiments , in order that the air to be exploded should be as free as possible from common air , the globe was first filled with a mixture of dephlogisticated and inflammable air , it was then exhausted , and the air to be exploded let in ; by which means , though the globe was not perfectly exhausted , very little common air could be left in it .
Royal_Society_Corpus_open_v6.0_text_106582_1784.txt	pa_nsubj	water/N	From what has been said there seems the utmost reason to think , that dephlogisticated air is only water deprived of its phlogiston , and that inflammable air , as was before said , is either phlogisticated water , or else pure phlogiston ; but in all probability the former .
Royal_Society_Corpus_open_v6.0_text_106582_1784.txt	pa_nsubj	water/N	From what has been said there seems the utmost reason to think , that dephlogisticated air is only water deprived of its phlogiston , and that inflammable air , as was before said , is either phlogisticated water , or else pure phlogiston ; but in all probability the former .
Royal_Society_Corpus_open_v6.0_text_106582_1784.txt	pa_nsubj	substance/N	There is the utmost reason to think , that dephlogisticated and phlogisticated air , as M. LAVOISIER and SCHEELE suppose , are quite distinct substances , and not differing only in their degree of phlogistication ; and that common air is a mixture of the two ; for if the dephlogisticated air is pretty pure , almost the whole of it loses its elasticity by phlogistication , and , as appears by the foregoing experiments , is turned into water , instead of being converted into phlogisticated air .
Royal_Society_Corpus_open_v6.0_text_106582_1784.txt	pa_nsubj	mixture/N	There is the utmost reason to think , that dephlogisticated and phlogisticated air , as M. LAVOISIER and SCHEELE suppose , are quite distinct substances , and not differing only in their degree of phlogistication ; and that common air is a mixture of the two ; for if the dephlogisticated air is pretty pure , almost the whole of it loses its elasticity by phlogistication , and , as appears by the foregoing experiments , is turned into water , instead of being converted into phlogisticated air .
Royal_Society_Corpus_open_v6.0_text_106582_1784.txt	pa_nsubj	pure/A	There is the utmost reason to think , that dephlogisticated and phlogisticated air , as M. LAVOISIER and SCHEELE suppose , are quite distinct substances , and not differing only in their degree of phlogistication ; and that common air is a mixture of the two ; for if the dephlogisticated air is pretty pure , almost the whole of it loses its elasticity by phlogistication , and , as appears by the foregoing experiments , is turned into water , instead of being converted into phlogisticated air .
Royal_Society_Corpus_open_v6.0_text_106582_1784.txt	pa_nsubj	contain/V	It was just said , that some dephlogisticated air was reduced by liver of sulphur to 1 / 3 0th of its original bulk ; the standard of this air was 4,8 , and consequently the standard of perfectly pure dephlogisticated air should be very nearly 5 , which is a confirmation of the foregoing opinion ; for if the standard of pure dephlogisticated air is 5 , common air must , according to this opinion , contain one - fifth of it , and therefore ought to lose one - fifth of its bulk by phlogistication , which is what it is actually found to lose .
Royal_Society_Corpus_open_v6.0_text_106582_1784.txt	pa_nsubj	rise/V	In procuring dephlogisticated air from nitre , the acid acts in a different manner , as , upon heating the nitre red - hot , the dephlogisticated air rises mixed with a little nitrous acid , and at the same time the acid remaining in the nitre becomes very much phlogisticated ; which shows that the acid absorbs phlogiston from the water in the nitre , and becomes phlogisticated , while the water is thereby turned into dephlogisticated air .
Royal_Society_Corpus_open_v6.0_text_106582_1784.txt	pa_nsubj	pure/A	It has been remarked , that the dephlogisticated air procured from nitre is less pure , than that from red precipitate and many other substances , which may perhaps proceed from unglazed earthen retorts having been commonly used for this purpose , and which , conformably to Dr. PRIESTLEY 'S discovery , may possibly absorb some common air from without , and emit it along with the dephlogisticated air ; but if it should be found that the dephlogisticated air procured from nitre in glass or glazed earthen vessels is also impure , it would seem to show that part weight of the dephlogisticated air , supposing it 800 times lighter than water , is one tenth of that of the nitre .
Royal_Society_Corpus_open_v6.0_text_106582_1784.txt	pa_nsubj	impure/A	It has been remarked , that the dephlogisticated air procured from nitre is less pure , than that from red precipitate and many other substances , which may perhaps proceed from unglazed earthen retorts having been commonly used for this purpose , and which , conformably to Dr. PRIESTLEY 'S discovery , may possibly absorb some common air from without , and emit it along with the dephlogisticated air ; but if it should be found that the dephlogisticated air procured from nitre in glass or glazed earthen vessels is also impure , it would seem to show that part weight of the dephlogisticated air , supposing it 800 times lighter than water , is one tenth of that of the nitre .
Royal_Society_Corpus_open_v6.0_text_106582_1784.txt	pa_nsubj	come/V	From what has been said it appears , that there is a considerable difference in the manner in which the acid acts in the production of dephlogisticated air from red precipitate and from nitre ; in the former case of acid comes over first , leaving the remaining substance deprived of part of its phlogiston ; in the latter the dephlogisticated air comes first , leaving the acid loaded with the phlogiston of the water from which it was formed .
Royal_Society_Corpus_open_v6.0_text_106582_1784.txt	pa_nsubj	come/V	Accordingly on urging this white mass with a more violent heat , the dephlogisticated air comes over , and at the same time part of the quicksilver rises in its metallic form , and also part of the white mass , united in all probability to a greater proportion of acid than before , sublimes ; so that the rationale of the production of dephlogisticated air from turbith mineral , and from red precipitate , are nearly similar .
Royal_Society_Corpus_open_v6.0_text_106582_1784.txt	pa_nsubj	phlogisticated/A	or if the bottle is quite full of the tincture , or if the air in it is phlogisticated ; whence it is natural to conclude , that the light enables the dephlogisticated part of the air to absorb phlogiston from the tincture ; and this appears to be really the case , as I find that the air in the bottle is considerably phlogisticated thereby .
Royal_Society_Corpus_open_v6.0_text_106582_1784.txt	pa_nsubj	phlogisticated/A	or if the bottle is quite full of the tincture , or if the air in it is phlogisticated ; whence it is natural to conclude , that the light enables the dephlogisticated part of the air to absorb phlogiston from the tincture ; and this appears to be really the case , as I find that the air in the bottle is considerably phlogisticated thereby .
Royal_Society_Corpus_open_v6.0_text_106582_1784.txt	pa_nsubj	become/V	Dephlogisticated spirit of nitre also acquires a yellow colour , and becomes phlogisticated , by exposure to the sun 's rays * ; and I find on trial that the air in the bottle in which it is contained becomes dephlogisticated , or , in other words , receives an increase of dephlogisticated air , which shows that the change in the acid is not owing to the sun 's rays communicating phlogiston to it , but to their enabling it to absorb phlogiston from the water contained in it , and thereby to produce dephlogisticated air .
Royal_Society_Corpus_open_v6.0_text_106582_1784.txt	pa_nsubj	part/N	Mr. SENEBIER finds , that plants yield much more dephlogisticated air in distilled water impregnated with fixed air , than in plain distilled water , which is perfectly conformable to the abovementioned hypothesis ; for as fixed air is a principal constituent part of vegetable substances , it is reasonable to suppose that the work of vegetation will go on better in water containing this substance , than in other water .
Royal_Society_Corpus_open_v6.0_text_106582_1784.txt	pa_nsubj	combination/N	According to this hypothesis , we must suppose , that water consists of inflammable air united to dephlogisticated air ; that nitrous air , vitriolic acid air , and the phosphoric acid , are also combinations of phlogisticated air , sulphur , and phosphorus , with dephlogisticated air ; and that the two former , by a further addition of the same substance , are reduced to the common nitrous and vitriolic acids ; that the metallic calces consist of the metals themselves united to the same substance , commonly , however , with a mixture of fixed air ; that on exposing the calces of the perfect metals to a sufficient heat , all the dephlogisticated air is driven off , and the calces are restored to their metallic form ; but as the calces of the imperfect metals are vitrified by heat , instead of recovering the metallic form , it should seem as if all the dephlogisticated air could not be driven off from them by heat alone .
Royal_Society_Corpus_open_v6.0_text_106582_1784.txt	pa_nsubj	principle/N	Another thing which Mr. LAVOISIER endeavours to prove is , that dephlogisticated air is the acidifying principle .
Royal_Society_Corpus_open_v6.0_text_106497_1783.txt	pa_nsubj	seem/V	The air seemed as if it were frozen , with the appearance of a fog , which did not * P. lxxi-lxxiii . ~ Reise durch Sibirien . ~ Nov. Comment . Petrop . tom . VI . p. 425 . ~ Ibid. tom . XI . p. 320 . ~ See also Mem. de l' Acad . des Sciences , 1749 , p. 1 . ~ Reise , Theil I. p. 355 . suffer the smoke to ascend as it issued from the chimnies .
Royal_Society_Corpus_open_v6.0_text_106497_1783.txt	pa_nsubj	change/V	I could not perceive or think , that the air had changed so suddenly to such an extraordinary degree of cold .
Royal_Society_Corpus_open_v6.0_text_106497_1783.txt	pa_nsubj	calm/A	On the 6th and 7th of that month happened the greatest cold I have ever experienced in Siberia ; the air was calm at the time , * Sibirische Brief , p. 29 . ~ Reise durch verschiedene Provinzen des Russischen Reichs , Theil .
Royal_Society_Corpus_open_v6.0_text_106497_1783.txt	pa_nsubj	grow/V	And that the mercury was really frozen became evident afterwards ; for about eleven in the forenoon , as the air grew warmer , it was found to have all subsided into the bulb , the small threads in the tube melting down into the vacuity left there , out of which it did not rise again till near two hours had elapsed .
Royal_Society_Corpus_open_v6.0_text_106497_1783.txt	pa_nsubj	grow/V	These phenomenon were clearly owing to its congelation , adhesion in the tube , and subsequent liquefaction as the air grew warmer .
Royal_Society_Corpus_open_v6.0_text_106497_1783.txt	pa_nsubj	become/V	When the air becomes sufficiently cold to freeze quicksilver , that metal must be standing about 39 ~ , or , in the common way of marking the boiling point , somewhere between 40 ~ and 50 ~ , in the tube of a thermometer exposed to it .
Royal_Society_Corpus_open_v6.0_text_106390_1780.txt	pa_nsubj	still/A	At this time the air was very still and serene , and the barometer stood at 3 ~ inches .
Royal_Society_Corpus_open_v6.0_text_106390_1780.txt	pa_nsubj	become/V	On the afternoon of this day , being Friday , Jan. 14th , the air became much warmer , and the barometer had now fallen four - tenths .
Royal_Society_Corpus_open_v6.0_text_106390_1780.txt	pa_nsubj	cold/A	We lowered the pole till the thermometer was brought down within half a foot of the ballustrade , but keeping it still a few inches to windward of the building , and by this means it was found that the air here was never colder than + 10 ~ .
Royal_Society_Corpus_open_v6.0_text_106390_1780.txt	pa_nsubj	thick/A	Both now and on the preceding night there were no clouds , though the air , as on the 14th , was a little thick towards the horizon , and there was always a very perceptible and constant motion of it from East to West .
Royal_Society_Corpus_open_v6.0_text_106390_1780.txt	pa_nsubj	still/A	The air on this day was quite still , and equally cold both at the upper and under stations .
Royal_Society_Corpus_open_v6.0_text_106390_1780.txt	pa_nsubj	cold/A	If we consider the excess of cold in the snow which Dr. IRVINE and I first observed as a phenomenon of the same kind with that described in the seventh experiment , and proceeding from the same cause , it is manifest that neither the one nor the other can be accounted for by any previous cold state of the air , according to an hypothesis alluded to in the beginning of this letter : for in the seventh experiment the air at the ballustrade was never colder than + 10 ~ , and yet the hoar - frost there was at the same time found in several instances as cold as + 2 ~ .
Royal_Society_Corpus_open_v6.0_text_106390_1780.txt	pa_nsubj	endeavour/V	It is manifest , that during the night the air surrounding the bars must have been constantly endeavouring to make them as cold as itself , whilst they , on the other hand , resisted this change by drawing heat from every neighbouring source which offered it , namely , from the parapet , from the pillars in the middle , and from the pillars at both ends immediately adjoining to the library , and to the house in the new court : for these bodies from their great bulk must have been but very little cooled in the course of the night .
Royal_Society_Corpus_open_v6.0_text_106390_1780.txt	pa_nsubj	seem/V	Wherever the air seems to have got the better in this struggle , as at the angles of the bars , which evidently must be the parts the soonest cooled , there we find that the hoar - frost was deposited , but no where else .
Royal_Society_Corpus_open_v6.0_text_106525_1781.txt	pa_nsubj	oppose/V	But if both methods of ascertaining the velocities of bullets are to be relied on , then the difference of the velocities , as determined by them in these experiments , can only be accounted for by supposing that it arose from their having been diminished by the resistance of the air in the passage of the bullets from the mouth of the piece to the pendulum ; and this suspicion will be much strengthened when we consider how great the resistance is that the air opposes to bodies that move very swiftly in it , and that the bullets in these experiments were not only projected with great velocities , but were also very light , and consequently more liable to be retarded by the resistance on that account .
Royal_Society_Corpus_open_v6.0_text_106340_1778.txt	pa_nsubj	pure/A	During the long severe winter season , the cold prevents them from airing this habitation , so that you may easily conceive , that the air can not be very pure , considering that four , five , or six people eat and sleep in one room , and undergo , during the night , a most stewing process from the heat and closeness of their situation ; insomuch that they have the appearance of being dippod in water , and raise a steam and smell in the room , not offensive to themselves , but scarcely supportable to the person whom curiosity may lead thither .
Royal_Society_Corpus_open_v6.0_text_106218_1775.txt	pa_nsubj	feel/V	The air felt very hot , but still by no means to such a degree as to give pain : on the contrary , I had no doubt of being able to support a much greater heat ; and all the gentlemen present , who went into the room , were of the same opinion .
Royal_Society_Corpus_open_v6.0_text_106218_1775.txt	pa_nsubj	make/V	To this circumstance the oppression on my breath must be partly imputed , the blood being forced into my lungs quicker than it could pass through them ; and hence it may very reasonably be conjectured , that should an heat of this kind ever be pushed so far as to prove fatal , it will be found to have killed by an accumulation of blood in the lungs , or some other immediate effect of an accelerated circulation ( b ) ; for all the experiments show , that heating the air does not make it unfit for respiration , communicating to it no noxious quality except a power of irritating .
Royal_Society_Corpus_open_v6.0_text_106218_1775.txt	pa_nsubj	remain/V	The reason is obvious ; when the same air remained for any time in contact with our bodies , part of its heat was destroyed , and consequently , we came to be surrounded with a cooler medium than the common air of the room ; whereas when ( b ) Since this experiment , I have observed the mucus from my lungs to be more serous than before , and to incline more to a saltish taste , though the lungs themselves seem perfectly sound in all other respects ; which raises a suspicion that some of the smaller arteries suffered a degree of dilatation from the increased impulse of the blood . fresh portions of the air were applied to our bodies in such a quick succession , that no part of it could remain in contact a sufficient time to be cooled , we necessarily felt the full heat communicated by the stove .
Royal_Society_Corpus_open_v6.0_text_106218_1775.txt	pa_nsubj	come/V	The unusual degree of fatigue which I felt from the experiment without my shirt , must be ascribed in great measure to the more violent effort which the living powers were obliged to exert , in order to preserve the due human temperature , when such hot air came into immediate contact with my body .
Royal_Society_Corpus_open_v6.0_text_106218_1775.txt	pa_nsubj	capable/A	To prove that there was no fallacy in the degree of heat shown by the thermometer , but that the air which we breathed was capable of producing all the well - known effects of such an heat on inanimate matter , we put some eggs and a beef - steak upon a tin frame , placed near the standard thermometer , and farther distant from the cockle than from the wall of the room .
Royal_Society_Corpus_open_v6.0_text_106218_1775.txt	pa_nsubj	hot/A	The evaporation itself , however , was more considerable in our experiments than it can be in almost any other situuation , because the air applied to the evaporating surface was uncommonly hot , and at the same time not more charged with moisture than in its ordinary state .
Royal_Society_Corpus_open_v6.0_text_106256_1777.txt	pa_nsubj	become/V	When the pump is worked as much as shall be thought necessary , the gage is pushed down till the open end is immerged in a cistern of quicksilver placed underneath ; the air being then let in , the quicksilver will be driven into the gage till the air remaining in it becomes of the same density with the external , and as the air always takes the highest place , the tube being uppermost , the expansion will be determined by the number of divisions occupied by the air at the top .
Royal_Society_Corpus_open_v6.0_text_106256_1777.txt	pa_nsubj	take/V	When the pump is worked as much as shall be thought necessary , the gage is pushed down till the open end is immerged in a cistern of quicksilver placed underneath ; the air being then let in , the quicksilver will be driven into the gage till the air remaining in it becomes of the same density with the external , and as the air always takes the highest place , the tube being uppermost , the expansion will be determined by the number of divisions occupied by the air at the top .
Royal_Society_Corpus_open_v6.0_text_106256_1777.txt	pa_nsubj	let/V	The pump was then worked , and the pear - gage was pushed down till its open end was immersed in the quicksilver in the cup : the air being then let into the receiver , it forced the quicksilver into the gage till it was filled within a 4000th part of the whole , so that by this gage the pump appeared to have expanded the air 4000 times .
