file	path	sfillers	sentence
Royal_Society_Corpus_open_v6.0_text_106758_1785.txt	pa_nsubj	kind/N	But , to my great surprise , not one particle of moisture came over , but a prodigious quantity of air , and the rapidity of its production astonished me ; so that I had no doubt but that the weight of the air would have been equal to the loss of weight both in the scales and in the charcoal ; and when I examined the air , which I repeatedly did , I found it to contain one - tenth of fixed air , and the inflammable air , which remained when the fixed air was separated from it , was of a very remarkable kind , being quite as heavy as common air .
Royal_Society_Corpus_open_v6.0_text_106758_1785.txt	pa_nsubj	have/V	The theory of this process I imagine to be , that the phlogiston from the charcoal reviving the iron , the water with which it had been saturated , being now set loose , affected the hot charcoal as it would have done if it had been applied to it in the form of steam as in the preceding experiments ; and therefore the air produced in these two different modes have a near resemblance to each other , each containing fixed air , both combined and uncombined , though in different proportions ; and in both the cases I found these proportions subject to variations .
Royal_Society_Corpus_open_v6.0_text_106758_1785.txt	pa_nsubj	cease/V	As the air ceased to come a considerable time before all the water had been transmitted through the tube containing them , I concluded that the air was formed from the phlogiston contained in the bones , and so much water as was necessary to give it the form of air .
Royal_Society_Corpus_open_v6.0_text_106758_1785.txt	pa_nsubj	differ/V	This air differs considerably from any other kind of inflammable air , being in several respects a medium between that from charcoal and that from iron .
Royal_Society_Corpus_open_v6.0_text_106758_1785.txt	pa_nsubj	disappear/V	Having got water from the scales of iron and of copper saturated with dephlogisticated air , by heating them in inflammable air , it occurred to me to make the same experiment with precipitate per se , and I found , that the moment that the focus of the lens fell upon this substance the mercury began to revive , the inflammable air rapidly disappeared , and water was formed on the sides of the vessel in which the experiment was made .
Royal_Society_Corpus_open_v6.0_text_106758_1785.txt	pa_nsubj	consist/V	But there was always a quantity of fixed air produced in this process ; and on the supposition that this air consists of the union of dephlogisticated and inflammable air , it proves that the dephlogisticated air which enters the iron expels more phlogiston than is necessary to constitute an equal weight of water , so that water does not contain so much phlogiston as iron ; but the difference is not very considerable .
Royal_Society_Corpus_open_v6.0_text_106758_1785.txt	pa_nsubj	expel/V	But there was always a quantity of fixed air produced in this process ; and on the supposition that this air consists of the union of dephlogisticated and inflammable air , it proves that the dephlogisticated air which enters the iron expels more phlogiston than is necessary to constitute an equal weight of water , so that water does not contain so much phlogiston as iron ; but the difference is not very considerable .
Royal_Society_Corpus_open_v6.0_text_106626_1786.txt	pa_nsubj	rush/V	After 4 minutes had elapsed , it had risen to 44~9 / 10 ; and at the end of 5 minutes it had risen to 48~2 / 10 . Experiment No 2 . Taking it now out of the boiling water I suffered it to cool gradually in the air , and after it had acquired the temperature of the atmosphere , which was that of 15 ~ R. ( the weather being perfectly fine ) , I broke off a little piece from the point of the small tube which remained at the bottom of the glass ball , where it had been hermetically sealed , and of course the atmospheric air rushed immediately into the ball .
Royal_Society_Corpus_open_v6.0_text_106626_1786.txt	pa_nsubj	warm/A	The thermometers No 1 . and No 2 . being again heated in boiling water , as in the last experiments , I took them out of the water , and suspended them in the middle of a large room , where the air ( which appeared to be perfectly at rest , the windows and doors being all shut ) was warm to the 16th degree of REAUMUR 'S thermometer , and the times of cooling were observed as follows . ( Exp. No 11 . ) ( Exp. No 12 . ) Thermometer No 1 . Thermometer No 2 . Surrounded by a Torricellian vacuum .
Royal_Society_Corpus_open_v6.0_text_106626_1786.txt	pa_nsubj	warm/A	Heated to 80~ , and suspended in the open Heated to 80~ , and suspended in the open air warm to 16 ~ . air warm to 16 ~ .
Royal_Society_Corpus_open_v6.0_text_106626_1786.txt	pa_nsubj	have/V	Taking the thermometer No 3 . out of the boiling water , I immediately suspended it in the middle of a large room , where the air , which was quiet , had the temperature of 18 ~ ~ R. and observed the times of cooling as follows : Time elapsed .
Royal_Society_Corpus_open_v6.0_text_106626_1786.txt	pa_nsubj	cool/A	It is true , the air of the room was somewhat cooler when the former experiment was made than when this latter was made with the thermometer No 3 ; but this difference of temperature , which was only 2~1/ 4 ( in the former case the thermometer in the room standing at 16 ~ , and in the latter at 18~1 / 4 ) certainly could not have occasioned the whole of the apparent difference in the results of the experiments .
Royal_Society_Corpus_open_v6.0_text_106626_1786.txt	pa_nsubj	receive/V	Does air receive heat more readily than it parts with it ?
Royal_Society_Corpus_open_v6.0_text_106626_1786.txt	pa_nsubj	become/V	Even the slowness with which the mercury in the thermometer No 4 . descended in this experiment from the 30th to the 20th , and from the 20th to the 10th degree , I attribute in some measure to the great conducting power of the moist air with which it was surrounded ; for the cylinder containing the thermometer and the moist air , being not wholly submerged in the freezing water , that part of it which remained out of the water was necessarily surrounded by the air of the atmosphere ; which being much warmer than the water , communicated of its heat to the glass ; which , passing from thence into the contained moist air as soon as that air became colder than the external air , was , through that medium , communicated to the bulb of the enclosed thermometer , which prevented its cooling so fast as it would otherwise have done .
Royal_Society_Corpus_open_v6.0_text_106626_1786.txt	pa_nsubj	damp/A	In the mean time I can not help observing , with what infinite wisdom and goodness Divine Providence appears to have guarded us against the evil effects of excessive heat and cold in the atmosphere ; for if it were possible for the air to be equally damp during the severe cold of the winter months as it sometimes is in summer , its conducting power , and consequently its apparent coldness , when applied to our bodies , would be so much increased , by such an additional degree of moisture , that it would become quite intolerable ; but , happily for us , its power to hold water in solution is diminished , and with it its power to rob us of our animal heat , in proportion as its coldness is increased .
Royal_Society_Corpus_open_v6.0_text_106626_1786.txt	pa_nsubj	damp/A	Every body knows how very disagreeable a very moderate degree of cold is when the air is very damp ; and from hence it appears , why the thermometer is not always a just measure of the apparent or sensible heat of the atmosphere .
Royal_Society_Corpus_open_v6.0_text_106626_1786.txt	pa_nsubj	pernicious/A	It is likewise plain from whence it is that sleeping in damp beds , and inhabiting damp houses , is so very dangerous ; and why the evening air is so pernicious in summer and in autumn , and why it is not so during the hard frosts of winter .
Royal_Society_Corpus_open_v6.0_text_106626_1786.txt	pa_nsubj	pass/V	The instrument , thus prepared , being put under the receiver of an air - pump , the air passed freely out of the globe and cylinder upon working the machine , but the valve above described prevented its return upon letting air into the receiver .
Royal_Society_Corpus_open_v6.0_text_106626_1786.txt	pa_nsubj	acquire/V	Torricellian VaCommon air , Rarefied air , Rarefied air , Moist air Water Mercury Heat acquired . cuum ( Exp.
Royal_Society_Corpus_open_v6.0_text_106653_1788.txt	pa_nsubj	weigh/V	This vessel was larger than that which I had used before , containing something more than eight ounce measures ; so that the air it contained , being onethird dephlogisticated and two - thirds inflammable , would have weighed about two grains .
Royal_Society_Corpus_open_v6.0_text_106653_1788.txt	pa_nsubj	iron/N	In all the preceding experiments the dephlogisticated air had been procured from manganese ; and in all the experiments mentioned in this Paper , the inflammable air was from iron by water only .
Royal_Society_Corpus_open_v6.0_text_106653_1788.txt	pa_nsubj	contain/V	As both the kinds of air made use of in these experiments were exceedingly pure , it seems evident , that phlogisticated air does not contain all the elements of nitrous acid ; but only supplies a base for it , the dephlogisticated air ( which was used in a greater proportion in the valuable experiment of Mr. CAVENDISH ) supplying the acidifying principle , as I had conjectured in the last Volume of my Experiments , p. 404 .
Royal_Society_Corpus_open_v6.0_text_106653_1788.txt	pa_nsubj	consist/V	But I find , that when steam is sent over it , in a red heat , in an earthen tube , fixed air is produced with the greatest rapidity , and in the same quantity as when it is dissolved in spirit of salt : and , making the experiment with the greatest care , I find , that fixed air consists of about half its weight of water .
Royal_Society_Corpus_open_v6.0_text_106653_1788.txt	pa_nsubj	weigh/V	According to this , as the air weighed 294 grains , the water in the fixed air must have been 80 parts of 147 of the whole .
Royal_Society_Corpus_open_v6.0_text_106653_1788.txt	pa_nsubj	contain/V	The quantity of fixed air would weigh 225 grains , and the water expended about 100 grains ; so that , in this experiment also , the fixed air must have contained about one - half of its weight of water .
Royal_Society_Corpus_open_v6.0_text_106653_1788.txt	pa_nsubj	sulphur/N	If there be no such thing as one principle of phlogiston , transferable from one substance to another , it must be admitted , that inflammable air from sulphur is real sulphur and water , that from iron , iron and water , as well as that very different substance , the scale of iron .
Royal_Society_Corpus_open_v6.0_text_106653_1788.txt	pa_nsubj	part/N	In the course of experiments recited in this Paper , I discovered more completely than before the source of my former mistake , in supposing that fixed air was a necessary part of the produce of red lead , and also of manganese .
Royal_Society_Corpus_open_v6.0_text_106653_1788.txt	pa_nsubj	come/V	Both these substances , I find , give of themselves only dephlogisticated air , and that of the purest kind ; and all the fixed air they yielded in my former experiments must have come from the gunbarrel I then made use of , which would yield inflammable air , which , with dephlogisticated air , forms fixed air .
Royal_Society_Corpus_open_v6.0_text_106653_1788.txt	pa_nsubj	tha/N	For though the dephlogisticated air from red lead was so pure tha , mixed with two measures of nitrous air , the three measures were reduced to five hundredth parts of a measure , and the substance gave no fixed air at all when it was heated in an earthen tube or retort ; yet by mixing iron filings with it , or with manganese , as I had formerly done with red precipitate , I got more or less fixed air at pleasure , and sometimes no dephlogisticated
Royal_Society_Corpus_open_v6.0_text_106652_1788.txt	pa_nsubj	prevent/V	Hence one of the most essential precautions for cooling water to the utmost without congelation , is to perform the experiment in a warm room , that the air in contact with the edges and surface of the water may prevent their sudden cooling .
Royal_Society_Corpus_open_v6.0_text_106652_1788.txt	pa_nsubj	act/V	And as water impregnated with air appeared less capable of being cooled than the same water deprived of its air , it seemed not impossible that the air might act likewise by producing thin plates in different parts of the fluid .
Royal_Society_Corpus_open_v6.0_text_106652_1788.txt	pa_nsubj	ascend/V	I therefore put down some air , retained by a small dish of wax , into the water to be cooled , and let it stay there till the whole was reduced many degrees below the freezing point ; but no congelation ensued : I then contrived to turn up the dish of wax in the water , so that the air it had carried down , escaping from under it , ascended as a bubble to the top of the water , and there burst : still the water retained its fluidity , notwithstanding the contact of a loose bubble of such cold air , and the motion produced by its explosion on the surface .
Royal_Society_Corpus_open_v6.0_text_106666_1788.txt	pa_nsubj	make/V	Some alkaline air being thus decomposed , and all its inflammable part separated by combustion in glass vessels inverted in quicksilver , I observed a considerable remainder of phlogisticated air ; and after many accurate experiments was fully convinced , that this phlogisticated air had made a part in the constitution of the alkali .
Royal_Society_Corpus_open_v6.0_text_106666_1788.txt	pa_nsubj	combine/V	Dephlogisticated air from each of them combines with the metal , and their other constituent parts , the phlogisticated air of the acid , and inflammable air of the water , being disengaged at the same instant , unite and form volatile alkali .
Royal_Society_Corpus_open_v6.0_text_106666_1788.txt	pa_nsubj	combine/V	When these two airs combine , it seems necessary that they part with a certain quantity of that fire to which they owe their elasticity ; and that , unless their attraction to each other exceed their attraction to fire , they will not unite .
Royal_Society_Corpus_open_v6.0_text_106666_1788.txt	pa_nsubj	combine/V	By this arrangement light inflammable air , which is given out from water in contact with iron filings , meeting with phlogisticated air at the instant of its extrication , combines with it , and forms volatile alkali .
Royal_Society_Corpus_open_v6.0_text_106666_1788.txt	pa_nsubj	present/A	Phlogisticated air is present in all parts of the terraqueous globe , and operations are constantly going on , by which inflammable air is separated from water , and perhaps from other bodies .
Royal_Society_Corpus_open_v6.0_text_106666_1788.txt	pa_nsubj	disappear/V	Some phlogisticated air disappears , and volatile alkali is formed .
Royal_Society_Corpus_open_v6.0_text_106666_1788.txt	pa_nsubj	combine/V	In hepatic air the parts of inflammable air are brought nearer to each other than they are in their simple aeriform state * , and therefore the phlogisticated air of the nitrous air combines with them , and generates volatile alkali .
Royal_Society_Corpus_open_v6.0_text_106666_1788.txt	pa_nsubj	state/N	From all these experiments it follows , that whether phlogisticated air be in a state of purity , or mixed with dephlogisticated air , as in the atmosphere , or combined with it as in nitrous air , it will in either case unite with the gravitating matter of light inflammable air , provided this substance be presented to it in a state of condensation ; but if the circumstances be reversed , the same combination does not take place .
Royal_Society_Corpus_open_v6.0_text_106666_1788.txt	pa_nsubj	leave/V	However , as the inflammable air leaves the sulphur upon the application of the electrical spark , it should seem , that the proper matter of inflammable air is more disposed to combine with fire than with sulphur ; which may be the reason why hepatic air is decomposed by nitrous air , while pure inflammable air is not affected by it . to the result of M , BERTHOLLET 'S experiments .
Royal_Society_Corpus_open_v6.0_text_106666_1788.txt	pa_nsubj	be/A	In what proportion must the phlogisticated and inflammable airs be , in order to form a mixture of this specific gravity ?
Royal_Society_Corpus_open_v6.0_text_106723_1787.txt	pa_nsubj	temperature/N	They were then removed into a very damp cellar , and placed upon a table , in the middle of a vault , where the air , which appeared by the hygrometer to be completely saturated with moisture , was at the temperature of 45 ~ F. ; and in this situation they were suffered to remain three days and three nights , the vault being hung round , during all this time , with wet linen cloths , to render the air as damp as possible , and the door of the vault being shut .
Royal_Society_Corpus_open_v6.0_text_106614_1786.txt	pa_nsubj	favourable/A	A Series of Observations on the Variation of the Light of the Star ~ Cephei . 1784 , Oct. 19 , at 81/ 2 h. I thought it was rather less than ~ Cephei . Oct. 20 , at 81 / 2 h. it was rather less than ~ , and about equal to ~ Cephei . Oct. 22 , at 91 / 2 h. less than ~ , and larger than ~ Cephei ; but the air was not very favourable . Oct. 23 , at 61 / 2 h. and 11 h. less than 7 Lacertae , and a little brighter than ~ Cephei . Oct. 24 , at 61 / 2 h. less than ~ Cephei , somewhat less than ~ Cephei , and something brighter than 7 Lacertae ; strong moonlight , and air rather hazy .
Royal_Society_Corpus_open_v6.0_text_106614_1786.txt	pa_nsubj	clear/A	At 81/ 2 h. to 11 h. a little less than ~ and ~ Cephei , and brighter than 7 Lacertae ; air clear and frosty ; the moon was very low at 11 h. Oct. 25 , at 6 h. 8 h. and 11 h. nearly the same ; air pretty clear , and moon bright .
Royal_Society_Corpus_open_v6.0_text_106614_1786.txt	pa_nsubj	same/A	At 81/ 2 h. to 11 h. a little less than ~ and ~ Cephei , and brighter than 7 Lacertae ; air clear and frosty ; the moon was very low at 11 h. Oct. 25 , at 6 h. 8 h. and 11 h. nearly the same ; air pretty clear , and moon bright .
Royal_Society_Corpus_open_v6.0_text_106614_1786.txt	pa_nsubj	clear/A	Oct. 26 , at 91 / 2 h. and 11 h. rather less than 7 Lacertae ; strong moon - light , but air very clear . Oct. 27 , 61 / 4 h. and 101/ 2 h. less than 7 Lacertae , and brighter than ~ Cephei ; ditto . Oct. 28 , at 91 / 2 h. and 12 h. just the same , if not less ; moon - light , but the air was remarkably clear .
Royal_Society_Corpus_open_v6.0_text_106614_1786.txt	pa_nsubj	clear/A	Oct. 26 , at 91 / 2 h. and 11 h. rather less than 7 Lacertae ; strong moon - light , but air very clear . Oct. 27 , 61 / 4 h. and 101/ 2 h. less than 7 Lacertae , and brighter than ~ Cephei ; ditto . Oct. 28 , at 91 / 2 h. and 12 h. just the same , if not less ; moon - light , but the air was remarkably clear .
Royal_Society_Corpus_open_v6.0_text_106614_1786.txt	pa_nsubj	clear/A	Oct. 31 , at 8 h. nearly equal to , if not less than , 7 Lacertae . Nov. 1 , at 111 / 2 h. somewhat less than 7 Lacertae ; air clear . Nov. 3 , at 121 / 4 h. equal to , if not a little less than , 7 Lacertae ; but the weather was not very favourable : it seemed to have increased since my first observation , which was at 51 / 2 h. Nov. 5 , at 13 h. brighter than 7 Lacertae , and less than ~ Cephei ; flying clouds , but air pretty clear .
Royal_Society_Corpus_open_v6.0_text_106614_1786.txt	pa_nsubj	clear/A	Nov. 6 , at 9 h. and 121/ 2 h. rather less than 7 Lacertae . Nov. 7 , at 71 / 2 h . I thought it still rather less than 7 Lacertae , but at 101/ 2 h. and 11 h. it was evidently less than it ; air clear .
Royal_Society_Corpus_open_v6.0_text_106614_1786.txt	pa_nsubj	clear/A	There was a haziness about 7 Lacertae . Nov. 15 , at 12 h. less than ~ Cephei , and brighter than 7 Lacertae ; fine aurora borealis , but the air was very clear .
Royal_Society_Corpus_open_v6.0_text_106614_1786.txt	pa_nsubj	clear/A	At 181/ 2 h. ditto ; but the air was not very clear .
Royal_Society_Corpus_open_v6.0_text_106614_1786.txt	pa_nsubj	clear/A	Nov. 16 , at 61 / 2 h. and 10 h. just the same , if not decreased at 10 h. Nov. 17 , at 61 / 4 h. to 101/ 2 h. a little less than 7 Lacertae , and brighter than ~ Cephei ; air clear .
Royal_Society_Corpus_open_v6.0_text_106614_1786.txt	pa_nsubj	clear/A	Nov. 18 , at 9 h. to 12 h. and 19 h. little brighter than ~ and ~ Cephei . Nov. 19 , at 6 h. to 10 h. just the same , being but a very little brighter than ~ and ~ Cephei ; air clear .
Royal_Society_Corpus_open_v6.0_text_106614_1786.txt	pa_nsubj	clear/A	At 181/ 2 h. it was increased , being now brighter than ~ and ~ Cephei . Nov. 20 , 7 h. to 11 h. considerably brighter than 7 Lacertae , something less than ~ Cephei ; air extremely clear at 11 h. Nov. 21 , at 6 h. exactly the same .
Royal_Society_Corpus_open_v6.0_text_106614_1786.txt	pa_nsubj	clear/A	Nov. 22 , at 91 / 4 h. about equal to 7 Lacertae ; moon - light . Nov. 25 , at 7 h. and 8 h. less than 7 Lacertae , and brighter than ~ and ~ Cephei ; air clear .
Royal_Society_Corpus_open_v6.0_text_106614_1786.txt	pa_nsubj	clear/A	Nov. 29 , at 71 / 2 and 8 h. less than 7 Lacertae , and something brighter than ~ and ~ Cephei . Nov. 30 , at 81 / 4 h. as last night ; air clear .
Royal_Society_Corpus_open_v6.0_text_106614_1786.txt	pa_nsubj	clear/A	At 101 / 4 h. between 7 Lacertae and ~ Cephei , but nearer ~ . At 101/ 2 h. 11 h. and 12 h. ditto , but nearer 7 Lacertae ; air clear .
Royal_Society_Corpus_open_v6.0_text_106614_1786.txt	pa_nsubj	clear/A	April 8 , at 71 / 2 h. considerably less than ~ Cephei , brighter than ~ and ~ Cephei ; but the air was not very clear .
Royal_Society_Corpus_open_v6.0_text_106614_1786.txt	pa_nsubj	clear/A	At 12 h. scarce at all altered , but if any thing it is a little increased ; air very clear , and observation good .
Royal_Society_Corpus_open_v6.0_text_106614_1786.txt	pa_nsubj	clear/A	May 23 , at 11 h. and 111/ 4 h. nearly equal to 7 Lacertae , and less than ~ Cephei . May 25 , at 10 h. and 12 h. a little less than ~ , and about equal to ~ Cephei . May 27 , at 10 h. between ~ and ~ Cephei , and considerably brighter than 7 Lacertae . May 28 , at 12 h. between ~ Cephei and 7 Lacertae . June 1 , at 91 / 2 h . I thought it less than ~ Cephei ; air not clear , and twilight pretty strong .
Royal_Society_Corpus_open_v6.0_text_106620_1786.txt	pa_nsubj	have/V	It is worthy of observation , that the water , as it springs into the first and third well , is quite transparent , but usually of a pearl colour in the second and fourth , similar in appearance to the water of the first or third well after it has been exposed a few hours to the air ; hence it is probable , that the external air has access to the water of the second and fourth well before it springs up into the bason .
Royal_Society_Corpus_open_v6.0_text_106620_1786.txt	pa_nsubj	consist/V	I will again take the liberty of repeating the query which I there proposed . ` ` Does this air , and the inflammable air separable from some metallic substances , consist of oleaginous particles in an elastic state ? ' ' When I ventured to conjecture , in the Essay alluded to , that sulphureous waters received their impregnation from air of a particular kind , I did not know that Professor BERGMAN had advanced the same opinion , and denominated that species of air , Hepatic Air .
Royal_Society_Corpus_open_v6.0_text_106620_1786.txt	pa_nsubj	give/V	In the Chemical Essay before referred to , I have shown , that the air separable from the lead ore of Derbyshire , or from Black - Jack , by solution in the acid of vitriol , impregnates common water with the sulphureous smell of Harrogate water ; and I have also shown that the bladder fucus or sea - wrack , by being calcined to a certain point , and put into water , not only gives the water a brackish taste , but communicates to it , without injuring its transparency , the smell , taste , and other properties of Harrogate water .
Royal_Society_Corpus_open_v6.0_text_106716_1787.txt	pa_nsubj	good/A	The air , however , was always not only much better than common air , but better than the air in general produced by the fresh leaves of plants exposed in water to the sun 's rays in the experiments of Dr. INGENHOUSZ ; HOUSZ ; and under the circumstances the most favourable , it was so good that 1 measure of it required 4 measures of nitrous air to saturate it , and 3,65 measures of the two airs were destroyed ; or , proved with nitrous air it gave 1a + 4n = 1,35 , which , I believe , is better than any air that has yet been produced in the experiments with vegetables .
Royal_Society_Corpus_open_v6.0_text_106716_1787.txt	pa_nsubj	have/V	The measure of the eudiometer being filled with air , I suffer it to remain quiet under water 15 seconds , or while I can leisurely count 30 , in order that the air may have time to acquire the temperature of the water in the trough , and that the water in the measure may have time to run down from the sides of the glass tube ; and in shutting the slider I take care to bring it to be exactly even with the surface of the water in the trough .
Royal_Society_Corpus_open_v6.0_text_106716_1787.txt	pa_nsubj	small/A	The air produced was so exceedingly small in quantity , that it could neither be proved , nor measured , there being only a few detached airbubbles , which had collected themselves near the top of the globe .
Royal_Society_Corpus_open_v6.0_text_106716_1787.txt	pa_nsubj	rise/V	The air produced naturally rises to that part of the globe which is uppermost , where it collects in a body , driving out an equal volume of water ; which , to prevent its running about , may be collected , by placing a proper vessel under the mouth , or end of the neck of the globe , to receive it .
